{"schema_version":1,"tool_version":"dev","catalog_version":"ai-robots-txt:a0fed45f0eb6723597028b49d5e0990dd4c41920+crawlledger-v1","key_id":"07a98710826ae6fb","created_at":"2026-07-24T13:12:29.546529817Z","format":"crawlledger-json","compression":"gzip","sha256":"6807a779588329db659d0a6fbe0290628379ae669f7d73cc7167cbdb5880167f","accepted":3,"rejected":0,"skipped":1,"privacy":{"client_ip":"hmac-sha256-truncated-128","query_values":"hmac-only","user_agent":"hmac-sha256-and-claim-only","referer":"host-only","raw_lines_retained":false,"anonymous":false,"residual_risks":["stable pseudonyms","timestamps","routes","crawler claims","referer hosts"]},"warnings":[]}
